{
  "schema_version": "1.0",
  "message_id": "msg-detection-001",
  "source_id": "camera-01",
  "node_id": "edge-node-a",
  "zone_id": "zone-a",
  "entity_id": "camera-01",
  "channel": "detections",
  "timestamp": "2026-08-25T12:00:00Z",
  "sequence_id": 42,
  "correlation_id": null,
  "coordinate_frame": "IMAGE",
  "payload": {
    "frame_ref": {
      "source_id": "camera-01",
      "capture_timestamp": "2026-08-25T11:59:59.800Z",
      "sequence_id": 1042,
      "frame_id": "frame-1042",
      "time_sync_state": "SYNCED"
    },
    "emitted_at": "2026-08-25T12:00:00Z",
    "inference_delay_ms": 200,
    "origin": {
      "tier": "edge",
      "kind": "precise",
      "optional": true,
      "label": "edge perception"
    },
    "bbox_space": {
      "format": "absolute",
      "origin": "top-left",
      "reference": {"width": 640, "height": 480}
    },
    "association": "enabled",
    "corridor": null,
    "detections": [
      {
        "track_id": "camera-01:track-7",
        "label": "person",
        "confidence": 0.94,
        "class_confidence": 0.91,
        "bbox": {"x": 120, "y": 80, "width": 90, "height": 210},
        "approach": null,
        "trail": [{"x": 151, "y": 180}, {"x": 165, "y": 185}],
        "source_id": "camera-01",
        "link": {
          "linked_sources": ["camera-02"],
          "confidence": 0.82
        }
      }
    ]
  }
}
